{
  "id": "acolyte",
  "name": "Acolyte",
  "source": "srd",
  "skillProficiencies": [
    "insight",
    "religion"
  ],
  "languageCount": 2,
  "feature": {
    "name": "Abri du fidèle",
    "text": "En tant qu'acolyte, vous imposez le respect à ceux qui partagent votre foi, et pouvez mener les cérémonies religieuses de votre divinité. Vous et vos compagnons aventuriers pouvez vous attendre à recevoir des soins gratuits dans un temple, un sanctuaire ou toute autre présence établie de votre foi, bien que vous soyez responsable de fournir toutes les composantes matérielles nécessaires aux sorts. Ceux qui partagent votre religion vous aideront (mais seulement vous) et vous offriront un mode de vie modeste. Vous pouvez également avoir des liens avec un temple spécifique dédié à votre divinité ou votre panthéon, et vous y avez une résidence. Cela pourrait être le temple où vous avez servi, si vous êtes resté en bons termes avec lui, ou un temple dans lequel vous avez trouvé une nouvelle maison. Lorsque vous êtes proche de votre temple, vous pouvez faire appel à des religieux pour vous aider, à condition que l'aide que vous demandiez ne soit pas dangereuse et que vous restiez en règle avec votre temple."
  },
  "text": "Vous avez passé votre vie au service du temple d'un dieu spécifique ou d'un panthéon de dieux. Vous agissez comme intermédiaire entre les royaumes des cieux et le monde des mortels, exécutant des rites sacrés et offrant des sacrifices pour conduire les fidèles face aux divins. Vous n'êtes pas nécessairement un clerc, car exécuter des rites sacrés religieux n'est pas la même chose que de canaliser la puissance divine. Choisissez un dieu, un panthéon de dieux ou un être quasi- divin, et travaillez avec votre MD pour préciser la nature de votre labeur religieux. Étiez-vous un fonctionnaire de bas rang dans un temple, élevé dès l'enfance pour aider les clercs à réaliser leurs rites sacrés ? Ou étiez-vous un religieux qui a soudainement reçu un appel pour servir son dieu d'une manière différente ? Peut-être êtes-vous le chef d'un petit culte en dehors de la structure établie d'un temple, ou membre d'un groupe occulte qui a servi un maître diabolique que vous reniez à présent."
}
